{
  "schema_version": 1,
  "id": "scan-20260619-018",
  "hypothesis_id": "hyp-20260618-001",
  "scanner_version": "v1",
  "config_hash": "",
  "created_at": "2026-06-19T06:25:57Z",
  "data_window": {
    "exchange": "GMO",
    "symbol": "BTC_JPY",
    "start_date": "2026-05-01",
    "end_date": "2026-05-15",
    "distinct_days": 16
  },
  "market_context": {
    "avg_half_spread_bps": 0.9167781583066404,
    "realized_volatility_bps": 6.001748388457214,
    "lead_lag": {
      "distinct_days": 16,
      "feature_leads_fraction": 0.625,
      "mean_best_lag_seconds": 0.6875,
      "mean_best_corr": 0.01397958262396199,
      "mean_corr_at_zero": 0.011789860570596805
    }
  },
  "regime_restricted": {
    "available": true,
    "regime_key": "BINANCE_BTC_USDT__GMO_BTC_JPY",
    "favorable_buckets": [
      0,
      1,
      2,
      3,
      4,
      5,
      6,
      7,
      20,
      46,
      47
    ],
    "criteria": {
      "volatility_spread": {
        "column": "p_gt_1x",
        "tercile": 0.3333333333333333,
        "n_favorable_buckets": 16
      },
      "lead_lag": {
        "column": "mean_best_corr",
        "tercile": 0.3333333333333333,
        "n_favorable_buckets": 16
      }
    },
    "fraction_of_rows": 0.2293831844686235,
    "market_context": {
      "avg_half_spread_bps": 1.01951756309144,
      "realized_volatility_bps": 7.081409939560611
    },
    "metrics": {
      "ic_pooled": 0.05525067864401998,
      "hit_rate": 0.5200124159604863,
      "bucketed_returns": [
        {
          "bucket": 0,
          "n": 593191,
          "mean_target_return": -1.6997401134540064e-05
        },
        {
          "bucket": 1,
          "n": 593169,
          "mean_target_return": 5.683516751764311e-06
        },
        {
          "bucket": 2,
          "n": 593168,
          "mean_target_return": 3.205396828842816e-05
        },
        {
          "bucket": 3,
          "n": 593175,
          "mean_target_return": 5.594788378357828e-05
        },
        {
          "bucket": 4,
          "n": 593164,
          "mean_target_return": 9.039401701378723e-05
        }
      ],
      "raw_sample_count": 2965867,
      "effective_sample_count": 45096.82146216185,
      "signal_autocorrelation_lag1": 0.9700047738153625
    }
  },
  "metrics": {
    "primary_horizon_seconds": 120,
    "ic_method": "spearman",
    "ic_pooled": 0.053066576414876006,
    "ic_by_day": {
      "2026-05-01 00:00:00+09": 0.06137501020969215,
      "2026-05-02 00:00:00+09": 0.05422543415557893,
      "2026-05-03 00:00:00+09": 0.0830149223466942,
      "2026-05-04 00:00:00+09": 0.0599236550479459,
      "2026-05-05 00:00:00+09": 0.07082821114318785,
      "2026-05-06 00:00:00+09": 0.03208977219235696,
      "2026-05-07 00:00:00+09": 0.04443678282532162,
      "2026-05-08 00:00:00+09": 0.03519606729823076,
      "2026-05-09 00:00:00+09": 0.04933013392827958,
      "2026-05-10 00:00:00+09": 0.031398827355167504,
      "2026-05-11 00:00:00+09": 0.04141998445162242,
      "2026-05-12 00:00:00+09": 0.056981372336129085,
      "2026-05-13 00:00:00+09": 0.04707803021996643,
      "2026-05-14 00:00:00+09": 0.0637295441060647,
      "2026-05-15 00:00:00+09": 0.06942372841023352,
      "2026-05-16 00:00:00+09": 0.037591072051343676
    },
    "hit_rate": 0.5173901823693041,
    "bucketed_returns": [
      {
        "bucket": 0,
        "n": 2585960,
        "mean_target_return": -4.024574285700835e-05
      },
      {
        "bucket": 1,
        "n": 2585957,
        "mean_target_return": -1.288660260145589e-05
      },
      {
        "bucket": 2,
        "n": 2585944,
        "mean_target_return": 4.5071199981015494e-06
      },
      {
        "bucket": 3,
        "n": 2585960,
        "mean_target_return": 2.574248132867284e-05
      },
      {
        "bucket": 4,
        "n": 2585928,
        "mean_target_return": 4.768106926216144e-05
      }
    ],
    "decay_by_horizon": [
      {
        "horizon_seconds": 30,
        "ic_pooled": 0.09351255066263638,
        "hit_rate": 0.5300269462938332,
        "n": 12930649
      },
      {
        "horizon_seconds": 120,
        "ic_pooled": 0.053066576414876006,
        "hit_rate": 0.5173901823693041,
        "n": 12929749
      },
      {
        "horizon_seconds": 300,
        "ic_pooled": 0.031240606360357668,
        "hit_rate": 0.5092674556671297,
        "n": 12927949
      }
    ],
    "raw_sample_count": 12929749,
    "effective_sample_count": 160925.39994992342,
    "signal_autocorrelation_lag1": 0.9753915065113284,
    "significance_method": "newey_west_hac",
    "hac_bandwidth": 54,
    "bootstrap_resamples": null,
    "bootstrap_seed": null,
    "bootstrap_ci_low": 0.04962310319335843,
    "bootstrap_ci_high": 0.05651004963639451,
    "stability_by_regime": {}
  },
  "threshold_verdict": {
    "status": "fail",
    "failed_rules": [
      "failed-cost-buffer"
    ],
    "yellow_flags": [
      "regime-stability-unproven"
    ],
    "verdict_text": "edge 0.440bps does not exceed required cost buffer 1.771bps (fees 0 + half_spread 0.917 (measured) + slippage 0.5, x1.25) stability_by_regime is not yet computed (scanner v1 gap)",
    "cost_buffer": {
      "edge_bps": 0.439634060595849,
      "fee_bps": 0,
      "half_spread_bps": 0.9167781583066404,
      "slippage_bps": 0.5,
      "safety_multiplier": 1.25,
      "required_bps": 1.7709726978833007,
      "cleared": false
    },
    "regime_restricted_cost_buffer": {
      "edge_bps": 0.5369570907416364,
      "fee_bps": 0,
      "half_spread_bps": 1.01951756309144,
      "slippage_bps": 0.5,
      "safety_multiplier": 1.25,
      "required_bps": 1.8993969538642999,
      "cleared": false
    }
  }
}